<!DOCTYPE compass-core-mapping PUBLIC 
    "-//Compass/Compass Core Mapping DTD 1.0//EN"
    "http://www.opensymphony.com/compass/dtd/compass-core-mapping.dtd">

<compass-core-mapping package="org.compass.core.test.transactionisolation.lucene">

    <class name="Cyclic1" alias="cyclic1">
    
        <id name="id" />
        
        <property name="value">
            <meta-data>value</meta-data>
        </property>
        
        <reference name="cyclic2" ref-alias="cyclic2" />
        
    </class>

    <class name="Cyclic2" alias="cyclic2">
    
        <id name="id" />
        
        <property name="value">
            <meta-data>value</meta-data>
        </property>
        
        <reference name="cyclic1" ref-alias="cyclic1" />
        
    </class>
</compass-core-mapping>
