<!DOCTYPE compass-core-mapping PUBLIC 
    "-//Compass/Compass Core Mapping DTD 1.0//EN"
    "http://www.opensymphony.com/compass/dtd/compass-core-mapping.dtd">

<compass-core-mapping package="org.compass.core.test.collection">

    <class name="SimpleTypeCollection" alias="simple-type-col">
    
        <id name="id" />
        
        <property name="value">
            <meta-data>mvalue</meta-data>
        </property>    
    
        <property name="strings" class="java.lang.String">
            <meta-data>mvalue</meta-data>
            <meta-data>svalue</meta-data>
        </property>
        
    </class>

    <class name="ExplicitTypeCollection" alias="explicit-type-col">
    
        <id name="id" />
        
        <property name="value">
            <meta-data>mvalue</meta-data>
        </property>    
    
        <property name="strings" class="java.lang.String">
            <meta-data>mvalue</meta-data>
            <meta-data>svalue</meta-data>
        </property>
        
    </class>

    <class name="A" alias="a">
        
        <id name="id" />
        
        <property name="value">
            <meta-data>value</meta-data>
        </property>    

        <component name="cb" ref-alias="b" />
        
    </class>

    <class name="B" alias="b" root="false">
        
        <property name="value">
            <meta-data>value</meta-data>
        </property>    
        <property name="value2">
            <meta-data>value2</meta-data>
        </property>    
    </class>

    <class name="X" alias="x">
        
        <id name="id" />
        
        <property name="value">
            <meta-data>mvalue</meta-data>
        </property>    

        <reference name="cy" ref-alias="y" />
        
    </class>
    
    <class name="Y" alias="y">
    
        <id name="id" />
        
        <property name="value">
            <meta-data>mvalue</meta-data>
        </property>    
        
    </class>

</compass-core-mapping>
