<!DOCTYPE compass-core-mapping PUBLIC
        "-//Compass/Compass Core Mapping DTD 1.0//EN"
        "http://www.opensymphony.com/compass/dtd/compass-core-mapping.dtd">

<compass-core-mapping package="org.compass.core.test.component.twosamecol">

    <class name="A" alias="a">
        <id name="id" accessor="field" />
        <component name="b1" ref-alias="b" accessor="field" />
        <component name="b2" ref-alias="b" accessor="field" />
    </class>

    <class name="B" alias="b" root="false">
        <property name="value" accessor="field" managed-id-index="un_tokenized">
            <meta-data>value</meta-data>
        </property>
    </class>

</compass-core-mapping>
