<?xml version="1.0"?>
<!DOCTYPE compass-core-mapping PUBLIC
        "-//Compass/Compass Core Mapping DTD 1.0//EN"
        "http://www.opensymphony.com/compass/dtd/compass-core-mapping.dtd">

<compass-core-mapping package="org.compass.core.test.component.poly1">

    <class name="WithoutPolyComponent" alias="rootwithoutpolycomponent">
        <id name="id">
            <meta-data>id</meta-data>
        </id>

        <property name="property">
            <meta-data>property</meta-data>
        </property>

        <component name="simpleComponent"/>

    </class>

    <class name="SimpleComponent" alias="scomponent" root="false">
        <property name="componentProperty">
            <meta-data>componentProperty</meta-data>
        </property>
    </class>

</compass-core-mapping>