<!DOCTYPE compass-core-mapping PUBLIC 
    "-//Compass/Compass Core Mapping DTD 1.0//EN"
    "http://www.opensymphony.com/compass/dtd/compass-core-mapping.dtd">

<compass-core-mapping package="org.compass.core.test.nosetter">

    <class name="A" alias="a">
    
        <id name="id" accessor="field" />
        
        <property name="value">
            <meta-data>mvalue1</meta-data>
        </property>

        <component name="b" />
    
    </class>

    <class name="B" alias="b" root="false">
    
        <property name="value">
            <meta-data>mvalue2</meta-data>
        </property>
    
    </class>

</compass-core-mapping>
