<!DOCTYPE compass-core-mapping PUBLIC
        "-//Compass/Compass Core Mapping DTD 1.0//EN"
        "http://www.opensymphony.com/compass/dtd/compass-core-mapping.dtd">

<compass-core-mapping package="org.compass.core.test.component.comp1">

    <contract alias="common">
        <property name="description" accessor="field">
            <meta-data>description</meta-data>
        </property>
    </contract>

    <class name="PersonName" alias="personName" root="false">
        <property name="names" accessor="field" class="java.lang.String">
            <meta-data>person</meta-data>
        </property>
    </class>

    <class name="Person" alias="person" extends="common" poly="true">
        <id name="id" accessor="field"/>
        <component name="names" accessor="field" ref-alias="personName"/>
    </class>

</compass-core-mapping>
