<!DOCTYPE compass-core-mapping PUBLIC 
    "-//Compass/Compass Core Mapping DTD 1.0//EN"
    "http://www.opensymphony.com/compass/dtd/compass-core-mapping.dtd">

<compass-core-mapping package="org.compass.core.test.managedid.index">

    <class name="A" alias="a1">
    
        <id name="id" accessor="field" />
        
        <property name="value1" accessor="field">
            <meta-data>value</meta-data>
        </property>

        <property name="value2" accessor="field">
            <meta-data>value</meta-data>
        </property>
        
    </class>

    <class name="A" alias="a2">

        <id name="id" accessor="field" />

        <property name="value1" accessor="field" managed-id-index="un_tokenized">
            <meta-data>value</meta-data>
        </property>

        <property name="value2" accessor="field" managed-id-index="un_tokenized">
            <meta-data>value</meta-data>
        </property>

    </class>

    <class name="A" alias="a3">

        <id name="id" accessor="field">
            <meta-data>value</meta-data>
        </id>

        <property name="value1" accessor="field">
            <meta-data>value</meta-data>
        </property>

        <property name="value2" accessor="field">
            <meta-data>value</meta-data>
        </property>

    </class>

</compass-core-mapping>
