<!DOCTYPE compass-core-mapping PUBLIC 
    "-//Compass/Compass Core Mapping DTD 1.0//EN"
    "http://www.opensymphony.com/compass/dtd/compass-core-mapping.dtd">

<compass-core-mapping package="org.compass.core.test.parent.cascade">

    <class name="A" alias="a1">
    
        <id name="id" accessor="field" />

        <component name="b" accessor="field" ref-alias="b1" />
    </class>

    <class name="B" alias="b1" root="false">
        <parent name="a" accessor="field" />
        <property name="value" accessor="field">
            <meta-data>value</meta-data>
        </property>
    </class>

    <class name="A" alias="a2">

        <id name="id" accessor="field" />

        <component name="b" accessor="field" ref-alias="b2" />
    </class>

    <class name="B" alias="b2" root="false">
        <parent name="a" accessor="field" cascade="all" />
        <property name="value" accessor="field">
            <meta-data>value</meta-data>
        </property>
    </class>
</compass-core-mapping>
