<!DOCTYPE compass-core-mapping PUBLIC 
    "-//Compass/Compass Core Mapping DTD 1.0//EN"
    "http://www.opensymphony.com/compass/dtd/compass-core-mapping.dtd">

<compass-core-mapping package="org.compass.core.load.simple">

    <class name="A" alias="a">
    
        <id name="id" />
        
        <property name="data1">
            <meta-data>mvalue</meta-data>
            <meta-data>mdata1</meta-data>
        </property>

        <property name="data2">
            <meta-data>mvalue</meta-data>
            <meta-data>mdata2</meta-data>
        </property>

        <property name="indexTime">
            <meta-data>mindexTime</meta-data>
        </property>

    </class>

</compass-core-mapping>
