<!DOCTYPE compass-core-mapping PUBLIC 
    "-//Compass/Compass Core Mapping DTD 1.0//EN"
    "http://www.opensymphony.com/compass/dtd/compass-core-mapping.dtd">

<compass-core-mapping package="org.compass.core.test.indexmanager">

    <class name="A" alias="a1">
    
        <id name="id" />
        
        <property name="value">
            <meta-data term-vector="positions_offsets">mvalue1</meta-data>
        </property>
    
    </class>

    <class name="A" alias="a2">

        <id name="id" />

        <property name="value">
            <meta-data term-vector="positions_offsets">mvalue1</meta-data>
        </property>

    </class>

</compass-core-mapping>
