<!DOCTYPE compass-core-mapping PUBLIC
        "-//Compass/Compass Core Mapping DTD 1.0//EN"
        "http://www.opensymphony.com/compass/dtd/compass-core-mapping.dtd">

<compass-core-mapping package="org.compass.core.test.find.aliases1">

    <class name="A" alias="a1" sub-index="ab">

        <id name="id">
            <meta-data index="un_tokenized">id</meta-data>
        </id>

        <property name="value">
            <meta-data index="un_tokenized">mvalue</meta-data>
        </property>

    </class>

    <class name="B" alias="b1" sub-index="ab">

        <id name="id">
            <meta-data index="un_tokenized">id</meta-data>
        </id>

        <property name="value">
            <meta-data index="un_tokenized">mvalue</meta-data>
        </property>

    </class>

</compass-core-mapping>
