<!DOCTYPE compass-core-mapping PUBLIC 
    "-//Compass/Compass Core Mapping DTD 1.0//EN"
    "http://www.opensymphony.com/compass/dtd/compass-core-mapping.dtd">

<compass-core-mapping package="org.compass.core.test.property.inputstream">

    <class name="BinaryArrayType" alias="b1">
    
        <id name="id" />
        
        <property name="bytes">
        </property>

        <property name="OBytes">
        </property>
    
    </class>

    <class name="InputStreamType" alias="b2">
    
        <id name="id" />
        
        <property name="inputStream">
        </property>
    
    </class>

</compass-core-mapping>
